Event,Artist,Location,PressText,SourceURL
2024-02-02 CTM Festival 2024 - Sustain,Various official lineup,Berghain; Panorama Bar,"Appearing as the duo Soulsick , Elvin Brandhi and DJ Scotch Egg will join forces in a fierce flurry of improvised vocals and hardcore. Brandhi never shies from being abrasive, letting a stream of consciousness take over to the tune of frenetic, computerized beats intent on scorching your speakers. Berlin-based Japanese screwball producer Shigeru Ishihara aka Dj Scotch Egg (WaqWaq Kingdom, Scotch Rolex) has been active for over two decades ever since rising to breakcore (and Gameboy gabber) fame after co-founding Brighton’s Wrong Music with Shitmat, Roger Species, and others. A UK underground fixture and leading innovator in fresh genres spanning the hardtek scene, Mandidextrous will bring a diverse combination of high energy 4x4 dnb, speedbass, jungletek keeping true to their 4x4 175bpm style. High energy from start to finish. The sounds of Lobster Theremin and Never Sleep affiliate Infinity Division move through the world of dance music with blistering speed, fusing elements of industrial and electro, with a penchant for melancholic trance-infused melody, through a distinctly punk lens. Under his Special Request alias, UK techno & house linchpin Paul Woolford takes as his ...",https://www.berghain.berlin/en/events/76345/
2024-02-03 Klubnacht,Various official lineup,Berghain; Panorama Bar,"Belgian techno producer Peter Van Hoesen is releasing his new album Towards the centre of time and surrounded by spirits in early March via Brussels label Vlek. Van Hoesen, currently living in Ho Chi Min, adds crystalline bleeps and obscure industrial sounds to his dense, purist techno. With ten years since his last album, his sound design remains more futuristic and otherworldly than almost anything else out there, and for this weekend's Klubnacht, he will present his work in a live set – the way he plays exclusively. One floor up sees a focus on US-American DJs with Daniel Bell, Magda and Mike Servito, who have each helped shape different decades of minimalist dance music. In the early 90s, Bell fused alarming 303s with the brutal stomp of European hardcore as half of Cybersonik along with Richie Hawtin; as DBX, he released completely skeletonized techno-funk tracks, creating one of the most morbid dancefloor hits of his generation 30 years ago with “Losing Control”. In the 00s, he pared down his sound even further and went in a housier direction, including projects such as the minimal supergroup Narod Niki, but Bell has remained true to his musical integrity to this day. This ...",https://www.berghain.berlin/en/events/76344/
2024-02-09 Running Back,Various official lineup,Panorama Bar,"Space Dimension Controller's output has always been an ode to a better future at the other end of the universe, with visual references to 70s retro-futurism and a wide musical range that paints a benevolent picture of a possible (dancefloor) world – an offering that has never seemed more valuable than today. Having released on such personality-driven labels as R&S, Ninja Tunes and Clone over the past 15 years, the Irishman's second acid-infused EP will be released in early February on Running Back, the label run by Gerd Janson, whom he says he met over a decade ago as an annoyingly enthusiastic, stoned 19-year-old obsessed with Break Machine and Paul Hardcastle. At this Running Back night, Space Dimension Controller will be playing live in the Panorama Bar, surrounded by an incredibly eclectic DJ line-up consisting of Finnish DJ and Running Back producer Katerina, Narciss, Gerd Janson and Berlin Duo DJ Heartstring.",https://www.berghain.berlin/en/events/77244/
2024-02-10 Klubnacht,Various official lineup,Berghain; Panorama Bar; Säule,"Berlin-based Canadian Merlin Ettore is a pioneer of hybrid drumming, i.e. the combination of acoustic and electronic drums. This symbiosis enables him to create a complex, challenging sound in which gigantic beats meet heavily modulated timbres. In his Sorcery project, he plays with a purely electronic setup and releases on labels such as ara, run by Kangding Ray. For this weekend's Klubnacht, he will play live at Berghain for the first time. Two excellent DJs from Japan, Haruka and ¥ØU$UK€ ¥UK1MAT$U, will also be performing. For Years, Haruka has co-organized the Future Terror parties with DJ Nobu, with whom he also shares a smooth, seductive mixing style. ¥UK1MAT$U, on the other hand, is far from mellow: the Osaka-born DJ transforms his love of eclectic sounds into intense, adrenaline-soaked sets. Sepehr, a DJ, producer and label operator from the Bay Area and now based in New York, will be playing live at Säule on Sunday afternoon. His own music ranges from aphrodisiac, slow-moving acid house to psychedelic drum cocktails, and on his label Shaytoon he mainly releases electronic music by artists from West Asia.",https://www.berghain.berlin/en/events/77197/
2024-02-16 Toy Tonics,Various official lineup,Panorama Bar,"With his releases on Toy Tonics, Sicilian artist Sam Ruffillo evokes the sound of the Italian Riviera and the hippie days of Ibiza in the late 70s. His take on smooth Balearic disco echoes his Italian disco predecessors: without the use of samples, he jams in his studio with guest musicians on guitar, bass, percussion and vocals – Italianissimo! Chloé Caillet, who grew up in New York, Paris and the UK, now resides in Ibiza, representing a new generation on the Spanish party island as Circo Loco resident DJ and founding member of the queer party collective XTRA. Her debut single “Love Ain't Over” became a hit in 2021 thanks to support from the likes of Gerd Janson, and she has curated music for the catwalk for Italian fashion house Miu Miu on several occasions. Along with London-based Guinny and the core team of Toy Tonics, Kapote and Stump Valley, Ruffillo and Caillet will be playing at Panorama Bar tonight.",https://www.berghain.berlin/en/events/77245/
2024-02-17 Klubnacht,Various official lineup,Berghain; Panorama Bar; Säule,"London-based producer Ryan Lee West, better known as Rival Consoles, was the first act to be signed to the Erased Tapes record label 15 years ago. Since then, over the course of nine albums, he has been working on a kind of humanisation of electronic music equipment that makes his work sound organic and personal, similar to that of Jon Hopkins or Nils Frahm. In his debut appearance at Klubnacht , Rival Consoles will be presenting his captivating mix of ambient, electronic shoegaze and minimal techno live at Säule. Also making her Berghain debut is Spanish DJ Anika Kunst, who releases her jagged, chord-driven techno on Ben Sims' Symbolism and is a resident at the Macarena Club in Barcelona. Brooklyn-based DJ/producer Antenes' sets range from acid-heavy techno to shimmering electro and dark ambient sounds. Her productions, created on self-built sequencers and modular synthesizers, have been released on L.I.E.S. and the Canadian ambient label Silent Season.",https://www.berghain.berlin/en/events/77198/
2024-02-23 Your Love,Various official lineup,Panorama Bar,"Another edition of the Your Love party series, lovingly curated by Lakuti and Tama Sumo, this time presenting two guest DJs from the USA whose praise cannot be overstated. New Jersey-born DJ Qu once described himself as “the dancer's DJ”, which is not only a reflection of his DJ skills but also refers to his background as a world-traveling house dancer in the 90s and as a former resident at the New York HouseDanceConference. DJ Qu has also been producing for the past two decades, releasing mainly on his own label Strength Music, creating his own dark voodoo house sound. Mark Grusane, known in Chicago as the former co-owner of the record store Mr. Peabody Records, has a profound knowledge of dance music history reaching far beyond his own city. He is particularly fond of the sounds of the mid-70s through mid-80s, having released three excellent compilations of disco, soul and funk rarities from this era on BBE. His own music, which he releases on labels such as Rush Hour or his own Disctechno, is old-school Chicago house at its best – jack your ass off!",https://www.berghain.berlin/en/events/77246/
2024-02-24 Klubnacht,Various official lineup,Berghain; Panorama Bar,"Gaston Volpe is an Argentinian DJ/producer whose music is heavily influenced by the 90s sound of the Detroit-Berlin axis. His recently launched label Transcent has released The Soul Is Healed EP, a superb EP which that doesn’t shy away from the great dub techno tracks of that era, with its massive reverb, engaging chords and syncopated percussion. He created all its tracks in one take by jamming, a good indicator for his live gig at Berghain for this weekend’s edition of Klubnacht. Berlin-based Lars Huismann and Amsterdam-based Rosati, two acts with current releases on Steffi's label Dolly, will also be playing. Rosati describes his style as ”hand-crafted“, always offering a human touch in his work, be it techno or house. Kenny Dope from New York is one of the most important house DJ/producers, with many accomplishments including sharing the US dance sound of the 90s. The son of Puerto Rican immigrants, he has released countless successful house remixes, whether solo or together with Little Louie Vega as Masters At Work, has been nominated for a Grammy four times, and is a gifted DJ and living encyclopaedia of beats – supa dope at Panorama Bar.",https://www.berghain.berlin/en/events/77199/
2024-03-01 SOUND METAPHORS,Various official lineup,Panorama Bar,"Kreuzberg record store institution Sound Metaphors is setting up shop at Panorama Bar, bringing along a few special guests. Acting Press is the fantastic vinyl-only label run by PLO Man and C3D-E, releasing carefully curated and usually quickly sold-out records that sound like the evolution of early-90s ambient techno. C3D-E will play a live set of his dancefloor-ready stoner techno, joined by Alicia Carrera, curator of the Club Cosmic series at Sameheads in Neukölln; Carl H, founder of the Animals on Psychedelics label; Donato Dozzy, Italian maestro of minimalist hypnotic techno; Ece Özel, DJ/promoter from Istanbul; and of course, a tandem set by Sound Metaphors heads Nemo and Castro. Bang!",https://www.berghain.berlin/en/events/77247/
2024-03-02 Klubnacht,Various official lineup,Berghain; Panorama Bar,"David Letellier aka Kangding Ray has undergone a fascinating musical development, from his beginnings in ambient music to an unmistakable techno style marked by precision and structure, woven into a crystal-clear sci-fi aesthetic. In his almost architectural music, the deepest of bass tones, intricate rhythms and wondrous melodies merge with abstract sound design, as you can experience tonight in his live set at Berghain. Rebecca Goldberg, a member of the Detroit Underground collective, has released music and multimedia projects ranging from acid techno to experimental electronic music, and this weekend, the 313 Acid Queen is playing at Klubnacht for the first time. AIDA, who began her career in the Vancouver rave scene before moving to San Francisco, is one of the acts playing at Panorama Bar. Her sound has evolved from minimal to electro, breaks and progressive house. In addition to playing clubs, she runs Apranik Records, a record label with roots in Iranian activism that pushes artists of Iranian descent.",https://www.berghain.berlin/en/events/77200/
2024-03-08 1. FC GRRRLS UNITED,Various official lineup,Panorama Bar,"With a focus on house music by FLINTA acts, the second annual 1. FC GRRRLS UNITED on International Women's Day moves to Panorama Bar. Adrian Blount aka GodXXX Noirphiles is an American non-binary artist and parent of the drag and performance art collective House of Living Colors, exploring themes such as Afrofuturism, feminism, sexuality and non-binary identity. Tonight, Adrian will present a vocal performance next to several DJs who put their own spin on house music. Along with a few newcomers making their Berghain debut, Natalie Robinson is back again, weaving funk, soul, R&B, garage and traditional Ghanaian sounds into her set. The profits of this night will be donated in equal parts to Hydra e.V. ( https://www.hydra-berlin.de ) and LesMigras ( https://lesmigras.de ).",https://www.berghain.berlin/en/events/77248/
2024-03-09 Klubnacht,Various official lineup,Berghain; Panorama Bar,"Batu from Bristol has been shaping the British techno sound since 2014 with his label Timedance. As a producer and with his radio show A Long Strange Dream, he tends to explore slower, more experimental realms, whereas in his DJ sets, he fittingly focuses more on the dancefloor, presenting various global club sounds and shifting tempos, from drum and bass to techno. For this weekend's Klubnacht , he will be playing at Panorama Bar with fellow DJs whose brand of house is so deep, it's below sea level. In the late 80s, Chez Damier was crucial in founding the legendary club The Music Institute in Detroit. He did A&R work for KMS and co-founded Prescription with Ron Trent, the groundbreaking Chicago label that released iconic deep-house tracks such as “Morning Factory” in the mid-90s. Hailing from France, DJ Deep is a proponent of classic techno and house sounds, with his finger on the pulse of Chicago, Detroit and New York, whether in his club sets, on his label Deeply Rooted or in his radio shows.",https://www.berghain.berlin/en/events/77201/
2024-03-15 Polari,Various official lineup,Panorama Bar,"Polari Records is a hi-NRG house label run by Cormac. The name refers to the slang of gay subculture in Britain until the legalization of homosexual acts in the late 60s – a constantly evolving mixture of Italian, English, circus jargon, Yiddish and Romani. The Polari label night at Panorama Bar welcomes Josh Caffe, a super-charismatic live act who has also made a name for himself as a DJ, producer and vocalist – be it with his solo productions, as frontman of the acid house group Paranoid London or as a featured guest with Honey Dijon. Visiting from France, Jordan Nocturne – relatively new to the label with the Dolly EP (its title means “pretty” in Polari) – has been DJing since the age of 13 and has released on Correspondant, Permanent Vacation and his own label Nocturne. There will also be DJ sets from Chinaski, fka.m4a, Glasgow duo LEZZER QUEST and Romy. Heartcore vibes!",https://www.berghain.berlin/en/events/77249/
2024-03-16 Klubnacht,Various official lineup,Berghain; Panorama Bar,"Verraco, DJ/producer from Medellín, Colombia, is known for his fusion of Latin American tribal techno, hyper-electronica and modern perreo bass. He co-runs TraTraTrax and Insurgentes, both significant platforms for Latinx producers. “Escándaloo” – the title frack from his first EP for Blawan and Pariah's label, Voam – was a festival rave hit last summer with its rambunctious kicks and escalating sirens. He'll be playing at this edition of Klubnacht along with the likes of Isabel Soto from Venezuela: Over the past couple of years, the Montreal-based DJ and founder of NYXII Records and member of the Arder collective has released her first tracks on labels such as Soma and Second State. Wallace, who lives in the tranquil medieval town of Shrewsbury in the West Midlands, has organized long club nights in Edinburgh and is now fully focused on furthering his skills as a DJ and producer. Wallace's debut album Red, Yellow, Black was released last year on Mule Musiq, merging nature sounds and field recordings with an emotionally charged house sound.",https://www.berghain.berlin/en/events/77202/
2024-03-22 Finest Friday,Various official lineup,Panorama Bar,"Although Cyan85 started his career just a few years ago, the Leipzig-based DJ has already established himself as a serious expert in Detroit-influenced electro with a steady flow of releases. His tracks on labels such as VOITAX and Curtis Electronix combine influences from Miami bass, ghettotech, booty house and acid to create a contemporary take on the tradition of Model 500 and Dopplereffekt. Partiboi69 has his very own approach to the genre: the Australian hedonist has created a musical and visual universe in which he reigns as a DJ, martial arts expert, rapper, fashion guru and sex icon. On his EP for Gerd Janson's Running Back label, out this month, he shows his sensitive side for the first time. With a background in performance art, x3butterfly is a Mexican-American DJ whose sets are inspired by early industrial and techno pioneers such as Throbbing Gristle and Robert Hood. Filling out the the lineup is Italian Berliner DJ Younger Than Me just released his debut album The Golden Age of Love on his label 90s Wax – a dynamic mix of progressive house, trance, EBM, breakbeat and techno elements.",https://www.berghain.berlin/en/events/77250/
2024-03-23 Klubnacht,Various official lineup,Berghain; Panorama Bar,"A piece of advice that Love On The Rocks label boss PARAMIDA has given to artists sending her demos over the years: “Imagine it's 1992. You're at a rave on the beach in Goa. It's 8 in the morning. What track is playing? Make that track!“ Back then, all sorts of things were being played in Goa: techno, Italian house, new beat and post-punk, a fusion of different genres that would only later develop into what we now call Goa trance. And this still untamed, unpolished mixture of psychedelic, uplifting, vibrating dance music is the tradition that her label stands for, which can be experienced in the form of several back-to-back sets for tonight's showcase at Panorama Bar. You can also look forward to Andy Butler aka Hercules & Love Affair, whose selections range from proto-house and the golden era of the 90s in New York to Chicago Jack tracks and contemporary house. There will also be a live act at Berghain: Austrian techno producer and sound-design lecturer Arthur Robert will demonstrate his love of Detroit-inspired grooves.",https://www.berghain.berlin/en/events/77203/
2024-03-29 Hamam Nights,Various official lineup,Panorama Bar,"Sedef Adasi is taking over Panorama Bar for the third time with her Hamam Nights series. This edition of the spa-themed rave features two back-to-back sets. Parisian DJ 131bpm has built up his reputation playing at queer parties, with sets influenced by various subgenres of electronic music such as vocal house, Detroit classic electro breaks, 90s progressive and Latin music. Tonight, he'll share the decks with Coco Cobra, a member of soft spot, a FLINTA/queer DJ collective based in Hanover. The second tandem set comes from Sedef and the label owner of Planet Euphorique, D. Tiffany from Canada. London-based Iranian producer Kasra V, who's had a radio show on NTS for the last ten years and has released on labels such as Radiant Love and Shaytoon, will once again show a strong passion for the breaky side of house music.",https://www.berghain.berlin/en/events/77251/
2024-03-30 Oster Klubnacht,Various official lineup,Panorama Bar; Berghain,"Berghain starts Sunday 4pm after SNAX Club. As always, Klubnacht on the long Easter weekend starts at Panorama Bar, and this time there are some special treats such as a special house set by DJ Rush. The Chicago legend played his earliest gigs back in the late 80s at the legendary Music Institute before developing his very own, sexually-charged spin on house in the early 90s, releasing on labels such as Trax, Dance Mania, Relief and Djax-Up. Even though Rush has been synonymous with a very hard and fast techno sound for the last 20 years, his roots are in disco and Chicago house, as you can hear this weekend. On Sunday at 16:00, once SNAX Club shuts down, we will open the door to Berghain. Besides DJs such as Honey Dijon, Dax J and Lolsnake, ItaloJohnson will play a farewell set, with a double meaning: after 15 years together, the Berlin trio will officially disband and play their very last set to close out Panorama Bar. Ciao e grazie per la musica!",https://www.berghain.berlin/en/events/77204/
2024-04-05 Finest Friday,Various official lineup,Panorama Bar,"Over the past three years, Berlin-based Australian producer Jennifer Loveless has put out five releases on labels such as Butter Sessions and Sex Tags UFO, emitting good vibes with her kaleidoscopic house sound. As resident DJ and curator of queer parties such as HOMODROP and Happy Endings at Dalston Superstore, East Londoner Marie Malarie supports up-and-coming artists. S-candalo is a DJ duo consisting of siblings Tania and Dominik Humeres-Correa (THC & DHC), who grew up in Germany with Colombian and Chilean roots. Showing an old-school 90s influence, their sound is imbued with queerness and energy, something they also cultivate in their own party series La Noche. Irish DJ/producer Sally C, who also lives in Berlin, has made a name for herself through a captivating mix of vintage house, acid, breakbeats and rave-inspired tracks.",https://www.berghain.berlin/en/events/77252/
2024-04-06 Klubnacht,Various official lineup,Berghain; Panorama Bar,"Slam are a Scottish techno institution that has witnessed all the developments in electronic music across more than three decades. Stuart McMillan and Orde Meikle began their career in Glasgow, making their first appearance at the influential Sub Club in 1989. The duo's breakthrough came in 1993 with the classic “Positive Education”, followed by the release of Daft Punk's first records, establishing their label Soma as one of the top sources of dance music in Europe. Even now, over 600 releases later, the label is still going strong, with the current Activate EP as a case in point: raw, mental techno hypnosis at the highest level. Slam will be playing live in Berghain for this edition of Klubnacht . Another pioneer in his field is Chida, who has been shaping the underground house scene in Tokyo since the early 90s. Known for his marathon sets often lasting more than twelve hours, he was a regular player at Cocktail d'Amore in Griessmühle, and from 2009 to 2019 also released Balearic house tunes by like-minded producers from Tokyo, London, Stockholm and Berlin on his finely curated label, Ene.",https://www.berghain.berlin/en/events/77205/
2024-04-12 Limousine Dream,Various official lineup,Panorama Bar,"In 2015, James Creed and Josh Tweek from the UK founded The Ghost in Berlin, a second-hand record store in a Mercedes camper van; the name was meant to symbolize the transience of the shop on wheels. With a carefully selected vinyl collection and the growing popularity of vinyl culture at the time, they attracted plenty of customers. As resident DJs under the same Moniker at a Berlin club floating on the Spree, they surrounded themselves with DJ friends such as Gene On Earth, KRN and Sugar Free. In 2022, they closed the store, sold the van and focused on their new label, Ghost Recs. For this edition of Gene On Earth's Limousine Dream night, some of the crew are reuniting, and cruising along is British producer Ron Obvious with a live set and London-based Canadian Peach, whose DJ sets are known for their warm, friendly and funky vibes.",https://www.berghain.berlin/en/events/77253/
2024-04-13 Klubnacht,Various official lineup,Berghain; Panorama Bar,"Colin Benders has had a notably unusual musical trajectory: a former jazz and hip-hop trumpeter who enjoyed crossover success as bandleader of a 50-piece orchestra before discovering his passion for modular synthesizers and live techno jams. For this edition of Klubnacht , he will play an exclusive live set at Berghain together with Steve Rachmad aka Sterac, completely improvised with an impressive arsenal of hardware. This is only their second performance together after debuting at last year's Fusion festival. Playing at the Panorama Bar for the first time is Victor. Born in Berlin in the 90s, he immersed himself in the world of electronic music at an early age and started DJing in the city's clubs at age 16. He now has residencies at Munich's Blitz Club and festivals Lighthouse and Nachtdigital, and with his own record label Magic Power has four releases to his name.",https://www.berghain.berlin/en/events/77206/
2024-04-19 Italorama Bar x Slow Motion,Various official lineup,Panorama Bar,"Berlin-born Polish DJ and producer Charlie (no relation to “Spacer Woman”) is an active member of Krakow's underground dance scene. She is known for her event series SZUM and serves as co-director of the project space Elementarz Dla Mieszkańców Miast, recognized as one of the most influential art initiatives in the city. Her debut EP Cold Inside , inspired by synth-wave and Italo disco, was released on Ferry Lane Records in 2022. For tonight's edition of Italorama Bar x Slow Motion , Charlie will be playing live – complemented by DJ sets from artists on the Italian-German label, which has been championing the rich heritage of Italian dance music since 2009. For example, Marcello Giordani is appearing under his new alias Italo Deviance: Inspired by early NYC disco and the Chicago house scene as well as Italo and cosmic sounds of the early 80s, Giordani founded the blog Italo Deviance and a label of the same name in 2008. His prior Italo disco-influenced productions, released under his birth name, have appeared on labels such as Mule Musiq, Endless Flight and of course Slow Motion.",https://www.berghain.berlin/en/events/77254/
