Date,Year,Month,EventTitle,Rooms,ArtistsPerRoom,Pressetext,SourceURL,Notes
2024-01-06,2024,January,Klubnacht,Berghain,"Berghain: 23:59 Kaiser ksr; 04:00 Mary Yuzovskaya Monday Off; 08:00 CHAMI face 2 face OPH; 12:00 Olivia Mendez Mord; 16:00 Norman Nodge Ostgut Ton; 20:00 Tasha Neighbourhood; 00:00 Amotik AMTK+","As with every year, the first Klubnacht of 2024 will have a slightly more intimate vibe. For this edition, only the main Berghain floor will be open.",https://www.berghain.berlin/en/event/76268/,"Official Berghain archive page; January-February 2024 run; Panorama Bar not listed for this event."
2024-01-13,2024,January,Klubnacht,"Berghain; Panorama Bar","Berghain: 23:59 Rødhåd WSNWG; 04:00 Paula Koski Soma; 08:00 Azu Tiwaline; 12:00 Inox Traxx Symbolism; 16:00 Kwartz PoleGroup; 20:00 Denise Rabe RABE; 00:00 Kyle Geiger made of CONCRETE | Panorama Bar: 23:59 nd_baumecker Ostgut Ton; 04:00 Francesco Menduni; 08:00 Violetta Funnuvojere; 12:00 Natalie Robinson; 16:00 DJ City; 20:00 Dinky Horizontal; 00:00 Abajour [BP]","DJ/producer Azu Tiwaline lives in the desert region of el-Djerid in southern Tunisia, where she combines field recordings from her surroundings and elements of traditional Berber music with stripped-down, hypnotic techno grooves.",https://www.berghain.berlin/en/event/76286/,"Official Berghain archive page."
2024-01-20,2024,January,Klubnacht,"Berghain; Panorama Bar","Berghain: 23:59 Erika Interdimensional Transmissions; 04:00 Setaoc Mass SK_eleven; 08:00 Reka Zalan; 12:00 Lolsnake; 16:00 Amanda Mussi; 20:00 Ron Albrecht Pure Traxx; 00:00 Fiedel Ostgut Ton | Panorama Bar: 23:59 Alinka Twirl; 04:00 Nathalie Seres Never Not Now; 08:00 Cormac Polari; 12:00 Pablo Bozzi Second Sight; 16:00 Alison Swing; 20:00 CHERIII; 00:00 Massimiliano Pagliara Funnuvojere","Reka Zalan is a Berlin-based DJ pursuing her passion for electronic music at various venues around the city.",https://www.berghain.berlin/en/event/76299/,"Official Berghain archive page; press text mentions Hard Wax, ://elements, ://about blank, and Coppi collective."
2024-01-27,2024,January,Klubnacht,"Berghain; Panorama Bar","Berghain: 23:59 David Fogarty Transmigration; 04:30 Justine Perry; 08:30 Vincent Neumann Unitas Multiplex; 12:30 Lea Occhi; 16:30 Nørbak HAYES; 20:30 DJ Maria.; 00:30 Sev Dah Proletarijat | Panorama Bar: 23:59 Mike Starr; 04:00 Yes'in; 08:00 Gabrielle Kwarteng; 12:00 livwutang; 16:00 Josh Cheon Dark Entries; 20:00 Ogazón; 00:00 Roi Perez Ostgut Ton","Liberté, égalité, solidarité - Spectrum Waves is a Parisian LGBTQ+ collective focusing on freedom, diversity and equality that regularly throws parties at the Gare des Mines.",https://www.berghain.berlin/en/event/76320/,"Official Berghain archive page; source text mentions Spectrum Waves and Gare des Mines."
2024-02-03,2024,February,Klubnacht,"Berghain; Panorama Bar","Berghain: 23:59 Jin Synth on board; 04:00 Peter Van Hoesen Live; 06:00 Virginia candy mountain; 10:00 Fadi Mohem MOHEM; 14:00 ABS8LUTE; 18:00 MARRØN; 22:00 Quelza Mord; 02:00 Efdemin Ostgut Ton | Panorama Bar: 23:59 Ady Toledano Hot Concept; 04:00 BASHKKA; 08:00 Jacob Meehan Smart Bar Chicago; 12:00 Sedef Adasï Public Possession; 16:00 Mike Servito The Bunker New York; 20:00 Magda; 00:00 Daniel Bell Accelerate","One floor up sees a focus on US-American DJs with Daniel Bell, Magda and Mike Servito, who have each helped shape different decades of minimalist dance music.",https://www.berghain.berlin/en/event/76344/,"Official Berghain archive page; source text notes Daniel Bell extended Panorama Bar closing set."
2024-02-10,2024,February,Klubnacht,"Berghain; Panorama Bar; Säule","Berghain: 23:59 Phase Fatale Ostgut Ton; 04:00 SORCERY Live; 05:00 ¥ØU$UK€ ¥UK1MAT$U; 09:00 Haruka Protection; 13:00 BLANKA Room Trax; 17:00 Adiel Danza Tribale; 21:00 Ben Klock Klockworks; 01:00 Ø [Phase] Modwerks | Panorama Bar: 23:59 Richard Akingbehin Refuge Worldwide; 04:00 Jennifer Loveless; 08:00 Rob Manga; 12:00 Ceri Find Your Own Records; 16:00 Soundstream Soundstream; 20:00 PARAMIDA Love On The Rocks; 00:00 Zombies In Miami Permanent Vacation | Säule: 19:00 Sepehr Live","Sepehr, a DJ, producer and label operator from the Bay Area and now based in New York, will be playing live at Säule on Sunday afternoon.",https://www.berghain.berlin/en/event/77197/,"Official Berghain archive page; includes Säule listing."
2024-02-17,2024,February,Klubnacht,"Berghain; Panorama Bar; Säule","Berghain: 23:59 Answer Code Request Ostgut Ton; 04:30 Yonti; 08:30 Antenes Silent Season; 12:30 Anika Kunst; 16:30 Pär Grindvik Stockholm LTD; 20:30 James Ruskin Blueprint; 00:30 Olivia Mendez Mord | Panorama Bar: 23:59 Partok; 04:00 DJ Minx; 08:00 Etapp Kyle Ostgut Ton; 12:00 nd_baumecker Ostgut Ton; 16:00 Chloé; 20:00 Marcel Dettmann BAD MANNERS; 00:00 Luigi Di Venere Philoxenia | Säule: 19:00 Rival Consoles Live Erased Tapes","London-based producer Ryan Lee West, better known as Rival Consoles, was the first act to be signed to the Erased Tapes record label 15 years ago.",https://www.berghain.berlin/en/event/77198/,"Official Berghain archive page; includes Säule listing."
2024-02-24,2024,February,Klubnacht,"Berghain; Panorama Bar","Berghain: 23:59 Paquita Gordon; 04:00 Volpe Live; 05:00 Stojche Tangible Assets; 09:00 Fred P Private Society; 13:00 Lars Huismann; 17:00 Rosati; 21:00 Steffi Candy Mountain; 01:00 The Lady Machine | Panorama Bar: 23:59 Fiedel Ostgut Ton; 04:00 Âme Innervisions; 08:00 Saint Guel; 12:00 Ouissam; 16:00 Shy One; 20:00 Kenny Dope Dopewax; 00:00 Massimiliano Pagliara Funnuvojere","Kenny Dope from New York is one of the most important house DJ/producers, with many accomplishments including sharing the US dance sound of the 90s.",https://www.berghain.berlin/en/event/77199/,"Official Berghain archive page."
