Event,Artist,Location,PressText,SourceURL
2022-08-27 Klubnacht,Various official lineup,Berghain; Panorama Bar; Garten,"Seit 2013 veranstaltet die brasilianische DJ Cashu die Mamba Negra -Partys, die mit einem Fokus auf Frauen, trans* und Mitglieder der LGBTQI+-Community in künstlerischen Positionen und im Team ein wichtiges Standing innerhalb der queeren Szene São Paulos haben. Mit dem Plattenlabel Mamba ermöglicht sie den lokalen Acts seit 2016 außerdem ein zweites kreatives Standbein. Ebenfalls ein Teil des Mamba-Negra-Kollektivs ist Tiago Franco alias Gezender, der im vergangenen Jahr die Corpo EP auf Mamba veröffentlicht hat und der heute Nacht in der Panorama Bar auflegt – zusammen mit Ady Toledano, DJ Holographic, Massimiliano Pagliara, Soundstream und der Japanerin Richii. Nach ein paar expliziten Sex-Trax wie „Sick Bitch“, die die dampfende Stamina und verschwitze Erotik alter Dance-Mania-Nummern in ein ziemlich zeitgenössisches und queeres Dance-Gewand packten, zeigt sich der in Berlin lebende New Yorker LSDXOXO auf seinen letzten Veröffentlichungen geradezu vulnerabel und Pop-affin. Unberechenbar bleiben auch seine DJ-Sets – wie man zur heutigen Klubnacht neben Acts wie Cashu, Naty Seres und SPFDJ im Berghain erleben kann.",https://www.berghain.berlin/en/events/73092/
2022-09-02 Finest Friday,Various official lineup,Panorama Bar,"Im überwiegend männerdominierten Genre Dubstep war die Britin Sara Abdel-Hamid für viele Jahre eine der wenigen, sichtbaren Frauen, die aktiv an der rapiden Evolution der Musik mitwirkten. Vor 14 Jahren erschien ihre Debüt-12"" auf Hyperdub, und obwohl sie ihrer grundsätzlichen Liebe zu UK Funky, R&B, Pop und Breaks im weitesten Sinne treu geblieben ist, hat sie ihren eigenen Sound im Laufe der Zeit kontinuierlich weiterentwickelt. Ihr letzte Single „I Need You“ ist ein von sommerlichen Insel-Vibes getragener, entspannt melodiöser Track, der einen in eine sehr komfortable, aurale Rausch-Satisfaktion versetzt. An ihrer Seite stehen am heutigen Finest Friday die musikalisch ähnlich divers aufgestellten Chloé Robinson (mit Nachholtermin aus Juli), Kikelomo (der Co-Founderin der neuen ghanaischen Internet-Radiostation Oroko Radio) sowie dem Briten Mella Dee, der auf seinem Label Warehouse Music ebendiese mit kräftig Disco-, Funk- und House-Einschlag veröffentlicht und heute Nacht wenigstens einmal Big Ang auflegen wird.",https://www.berghain.berlin/en/events/73171/
2022-09-03 Klubnacht,Various official lineup,Berghain; Panorama Bar; Garten,"Viele Producer haben sich in den vergangenen Jahren gesellschaftspolitisch positioniert. Für den in New York lebenden, bermudianischen Künstler Russell E.L. Butler ist das Private, immer noch, politisch. So stellte er eine seiner letzten EPs, Emotional Bangers Only 2 , als „ songs about sex, intimacy, hoeing. And attempting to progress as a relational being “ vor. Auf Collective Response To Giving Up thematisiert er wiederum die konservativen, kolonialen Strukturen, von denen er die Technowelt durchdrungen sieht. Seine überwiegend instrumentale Musik verbindet die kristallinen Klänge Modularsynthesizer mit emotionalen Pads und lässt straighten Techno auf Breakbeats clashen. Butler performt heute Nacht live in der Panorama Bar, wo ansonsten mit Diskonnected; einem taiwanesischen DJ und Betreiber von Plattenlabel, Mixes-Reihe und Eventplattform Smoke Machine; Ouissam, ein in Vietnam lebender DJ, der mit Snug eine queere Partyreihe in Hanoi organisiert; und dem herrlich psychedelisch-spirituell spielenden Sunju Hargun aus Bangkok ein musikalischer Blick in den musikalischen (Süd-)Osten geworfen wird. Drone Operations hieß eine der EPs des Berliner Produzenten Tobias Lisius alias ...",https://www.berghain.berlin/en/events/73093/
2022-09-09 Love On The Rocks,Various official lineup,Panorama Bar,"Es bietet sich natürlich an, die Musik eines in Kalifornien aufgewachsenen (und inzwischen in Berlin lebenden) DJs als sonnendurchflutet zu bezeichnen. Im Fall von Gene On Earth kommt man aber nur schwer drumrum. Was dieser auf seinem Label Limousine Dream und mit seinen eigenen Produktionen wie dem aktuellen Album Time On The Vine veröffentlicht, ist eine auf mediterrane Freiluftpartys einstimmende Musik, die von Downtempo, Breakbeats, bleepigem Techhouse und pianoseeligen Oldschool-House-Tracks reicht. Mit diesem fein sprudelnden, grundsätzlich optimistischen Sound passt er natürlich bestens zu Love On The Rocks, wo es heute neben Host und unserer Resident Paramida, Alex Kassian (dem Co-Host der LOTR-Radioshow auf Refugee Worldwide), und Francesco del Garda auch noch ein B2B-Set von Laurine und Cecilio geben wird. Beide sind Mitveranstalter der Berliner Partyreihe und des gleichnamigen Labels Slow Life, das Resident Advisor als eines der einflussreichsten Labels dieses Jahrzehnts bezeichnet.",https://www.berghain.berlin/en/events/73172/
2022-09-10 Klubnacht,Various official lineup,Berghain; Panorama Bar,"Das schottische Duo Slam war gefühlt schon immer da. Seit den frühen 90er Jahren legen sie auf, spielen live und produzierten annähernd hundert mehr als solide Techno-EPs, darunter Meilensteine wie „Positive Education“. Sie haben auf ihrem Label Soma Quality Recordings insgesamt mehr als 600 Releases und auf ihrer wöchentlichen Slam Radio Show über 500 Podcasts verschiedener Künstler*innen veröffentlicht. Dass sie bei diesem enormen Output auch musikalisch neugierig und fresh geblieben sind, kann man bei der heutigen Klubnacht im Berghain nachvollziehen. Zweiter Live-Act ist Stef Mendesidis, der beim Musikmachen dem Prinzip der One-Take-Aufnahme folgt. Seine EPs auf Klockworks beinhalten ultra-effektive, zeitlose und wiedererkennbare Techno-Tracks, die wie maßgeschneidert für den großen Dancefloor sind. Dazu gibt es mit der Detroiterin Erika und Helena Hauff zwei exzellente DJs mit Vorliebe für die düsteren und harscheren Enden von Techno und Electro. In der Panorama Bar bringt Gideön, der Londoner Mitveranstalter des fabelhaft queeren Glastonbury Nachtclubs NYC Downlow , eine seiner Resident-DJs mit: Grace Sands hat ihre Wurzeln in der britischen DIY-Soundsystem- und ...",https://www.berghain.berlin/en/events/73094/
2022-09-16 Steel City Dance Discs,Various official lineup,Panorama Bar,"Positive Energy Forever hat sich das in Australien gegründete und inzwischen in UK ansässige Label Steel City Dance Discs auf die Fahnen geschrieben. Es ist auch der Titel eines der unzähligen Hits ihres vielleicht populärsten Acts, Mall Grab, der ebenfalls einer der drei Betreiber des Labels ist. Er hat in den vergangenen sieben Jahren auf über zwanzig Releases so ziemlich jedes Dance-Genre durch den speziellen Mall-Grab-Filter gejagt und, mit einprägsamen Melodien und Samples bestückt, in ein nach Vintage-Equipment klingendes, voluminöses House- oder Techno-Korsett übersetzt. Steel City Dance Discs kommen heute Nacht mit einem bunten Querschnitt zur Labelnacht in die Panorama Bar: der Australier Loods mit seinem infektiösen Disco-House-Sound; die zwischen melodischen Trance, Techno und Post-Punk eklektisch spielende Italienerin Matisa; der für seine Adrenalin-geschwängerten Techno-Tracks mit runtergepitchen Vocals bekannte Skin on Skin; die ebenfalls in UK lebende Australierin Surusinghe mit Vorlieben für Bass, Jungle, Breakbeat und Techno; zuguterletzt das Label-DJ-Team S.C.D.D. Hazmat.",https://www.berghain.berlin/en/events/73173/
2022-09-17 Klubnacht,Various official lineup,Berghain; Panorama Bar; Säule,"Noporn ist keine erotikfeindliche Puritanistenorganisation, sondern ein äußerst weltliches, brasilianisches Electronic-Dance-Pop-Duo aus São Paulo. Liane Padhilas nonchalanter Spoken-Word-Gesang und Lucas Freires emotionale Musik behandeln Themen rund um Sexualität und Nachtleben. Ihr selbstbetiteltes Debütalbum von 2006 enthielt mit „Baile de Peruas“ und „Xingu“ zwei Songs, die in Brasilien zu Underground-Hits wurden. Anfang September erschien ihr neues Album Contra Dança , das sie heute im Rahmen der Klubnacht in der Säule live präsentieren werden. Ebenfalls aus São Paulo kommen die beiden DJs Davis und Zopelar, heute in der Panorama Bar. Beide sind Teil des Kollektivs ODD und aktive Kräfte in den subkulturellen Szenen ihrer Stadt. Während Davis schon öfters in der Panorama Bar aufgelegt hat, ist dies die Premiere für Zopelar. Seine Musik ist eine schnurrbärtige Mischung aus House, Boogie und Disco, die den brasilianischen Jazz-Funk in eine 80er-Jahre-inspirierte Version von Slo-Mo-House überführt. Im Berghain gibt es neben einem Live-Act von Blawan und Parriah unter ihrem Karenn-Alias unter anderem Sets der Chilenin Diamin und Lolsnake, irakisch-amerikanische DJ und Host sowie ...",https://www.berghain.berlin/en/events/73095/
2022-09-23 PAN,Various official lineup,Panorama Bar,"For this edition, PAN is inviting label-artist CRYSTALLMESS, the french producer and artist whose music immediately stands out for its abrasive dancefloor feel. Berlin-based duo Dmitra & Soraya are joining the line-up with a live performance, which brings bass-heavy club tracks paired with infectious vocal hooks. Next is Liyo, who is a Brussels-based producer, who meticulously stitches together music from all over the spectrum into a unique and sentimental narrative. PAN mainstay M.E.S.H. blurs the line between sound design and intelligent dance music. Lastly UNIIQU3, the Jersey Club Queen will be joining this night for her debut in Panorama Bar. From throwing some of Jersey's most recognized events to now spreading the genre of Jersey Club across the globe from Australia to South America leaving her impact wherever she goes. Rounding up this night's line up is Bill Kouligas, founder of the label.",https://www.berghain.berlin/en/events/73174/
2022-09-24 Klubnacht,Various official lineup,Berghain; Panorama Bar,"Die in München lebende DJ Lindsey Wang alias Polygonia zählt zu den interessantesten, neueren Künstler*innen im Deep-Techno-Bereich. Ihre in den vergangenen zwei Jahren veröffentlichten Releases auf Labels wie das von ihr mitgeführte IO enthalten konzentrierte, subtile und einnehmende Musik zwischen naturalistischen Ambient (wie auf ihrem Album Abbilder einer vergessenen Welt ) und mysteriös-rituellem Minimaltechno. Polygonia spielt heute ihr Berghain-Debüt, daneben Leute wie Freddy K, KI/KI und Adiel sowie ein Live-Act des russischen Producers Philipp Gorbachev, der dafür bekannt ist, sakrale Klänge wie Glockengeläut in seine Techno-Tracks einzubauen. In der Panorama Bar gibt es mit K'Alexi Shelby und Hiroko Yamamura zwei verschiedene Generationen Chicagoer DJs zu hören. Shelby hat bereits 1987 mit „Essence Of A Dream“ einen frühen Deephouse-Blueprint für die Ewigkeit gedrechselt, sein zwei Jahre später auf Transmat veröffentlichtes „All For Lee-Sah“ zählt ebenso zu den absoluten Klassikern im Chicago-House-Kanon. Yamamura zeigt sich generell eher von der technoideren Seite des Windy-City-Sounds beeinflusst, auf ihren aktuellen Produktionen fährt die Resident-DJ der Chicagoer ...",https://www.berghain.berlin/en/events/73096/
2022-09-30 AD 93,Various official lineup,Panorama Bar,"AD 93 remains a label that surprises with every release. Although a lot of what Nic Tasker has released on his platform in the past months alone won’t be defined as club music: From the imaginary medieval music of Polish composer Wojciech Rusin to the sloppy leftfield electronica of Luis (an alias of DJ Python) to the teenage angst indie rock of IVVVO. Still, of course, Tasker is still strongly rooted in the dancefloor, which is reflected in the programming for tonight's AD 93 night at Panorama Bar. Parisian Bambounou has represented a modern techno sound for more than a decade and, after several dancefloor stompers, most recently released an experimental doomcore EP inspired by the unfinished architecture of the Sagrada Família. Brit Bradley Zero runs the Rhythm Section International label and party series of the same name, releasing house, funk and jazz-influenced music from around the world. And Paquita Gordon is an Italian-born vinyl DJ and resident of Milan's Terraforma festival, whose genre-transcending sets fit perfectly with AD 93's anything-goes philosophy.",https://www.berghain.berlin/en/events/73175/
2022-10-01 Klubnacht,Various official lineup,Berghain; Panorama Bar,"Der Reiz an back-2-back-Sets ist der Moment des Unberechenbaren. Die musikalische Dynamik, die entsteht, wenn DJs außerhalb ihrer gewohnten Auflege-Routine zusammen spielen, birgt nämlich ein Risiko: Klappt es mit dem Flow? Können zwei individuelle Stile zusammengenommen mehr ergeben, als die Summe der einzelnen Teile? Das hält die musikalische Kommunikation lebendig und in Bewegung. In diesem Monat haben wir mehr DJs als sonst üblich dazu eingeladen, mit einem oder einer geschätzten Kolleg/in zu spielen. Den Anfang machen zu dieser Klubnacht Berghain-Resident Marcel Dettmann und Detroits Electro-Instanz DJ Stingray, sowie ein Stockwerk höher Âme und Jennifer Cardini: May the funk be with you! Im Berghain spielt heute außerdem Hadone neben anderen Acts wie unseren Residents Fadi Mohem und Luke Slater, der letztere als Planetary Assault Systems Live-Act. Slater hat mit seinen aktuellen PAS-Releases auf Token wieder einmal gezeigt, warum er seit drei Dekaden zu den stärksten und innovativsten Techno-Produzenten überhaupt gehört. In der Panorama Bar frönt heute Ben Klock, neben wohlbekannten Acts wie Dinky, Radio Slave und Tijana T, seiner housigen Seite.",https://www.berghain.berlin/en/events/73097/
2022-10-07 Live From Earth Klub,Various official lineup,Panorama Bar,"MCR-T ist die Berliner Antwort auf Bass Music und Detroit Club: auf seinen vor Energie berstenden Tracks rappt er rasant und mitreißend über Party-affirmative Electro- und Techno-Beats. Sein neues Album heißt, in Anlehnung an ein von ihm gesampeltes Grace-Jones-Zitat, MY VOICE MY WEAPON OF CHOICE – in musikalischen Großbuchstaben wird dann auch das ganze Album durchgezogen. MCR-T spielt heute im Rahmen der Labelnacht Live From Earth Klub in der Panorama Bar. Julian Muller ist ein in Brüssel lebender Franzose, der seit drei Jahren Musik veröffentlicht und das Label Nail führt. Auf seinem auf Lobster Theremin veröffentlichten Album Playing With The Devil und auf seinen Maxis fährt Muller einen schnellen, trancigen Techno-Sound mit Emo-Vocals. Neben Muller spielt heute 41ISSA im B2B mit O-Wells, die Soft-Gabber-Producerin horsegiirL, Live-From-Earth-Klub-Resident DJ Gigola und als Live-Act der Nacht der Techno-geschulte Niederländer Dissolver. Everybody dance now!",https://www.berghain.berlin/en/events/73176/
2022-10-08 Klubnacht,Various official lineup,Berghain; Panorama Bar,"Die musikalische Welt, in der wir leben, sie wäre sicher eine andere ohne das Wirken von Moritz von Oswald. Angefangen mit seiner Mitgliedschaft bei der Hamburger 80er-Jahre-Avantgarde-Band Palais Schaumburg, ist es vor allem seine von den frühen 90ern bis 2005 anhaltende Partnerschaft mit dem Hard-Wax-Gründer Mark Ernestus, die seriösen Techno prägen sollte wie keine andere. Ihre Projekte Basic Chanel, Maurizio, Quadrant, Round One und Rhythm & Sound haben für alle Zeiten den Standard für Dub-Techno, Chicago-beeinflussten House und Dub-Reggae gesetzt, zusammen mit ihren minimalistischen Designs zählen die Platten bis heute zum unstürzbaren Kanon elektronischer Musik. Seitdem hat von Oswald in wechselnder Besetzung (u.a. mit Laurel Halo, Tony Allen und Vladislav Delay) elektronische Improv-Jams als Moritz von Oswald Trio veröffentlicht, mit der kirgisischen Folkband Ordo Sakhna und den Detroitern Carl Craig und Juan Atkins zusammen gearbeitet. Heute legt er neben dem Wahlberliner Amotik, der Chinesin Cora und dem Japaner Takaaki Itoh im Berghain auf. In der Panorama Bar spielt neben Alinka, David Elmelech und Soundstream auch die in Seoul geborene DJ Fart In The Club ihren ...",https://www.berghain.berlin/en/events/73098/
2022-10-14 Your Love,Various official lineup,Panorama Bar,"Kaum ein DJ passt besser zu dem wertschätzenden Programmethos von Lakutis und Tama Sumos Partyreihe Your Love , als der in der Geburtsstädte von House, Chicago aufgewachsene Rahaan. Seit über drei Dekaden legt er eine beseelte und unorthodoxe Mischung aus Disco, Funk, Soul und House auf, über die Grenzen der Windy City hinaus bekannt wurde er durch seine geschickt auf den Dancefloor produzierten Edits. In Kürze erscheint außerdem eine von ihm zusammengestellte Ausgabe der Under The Influence -Compilations auf Z Records, die einen Blick auf seine musikalischen Einflüsse preisgibt. Neben Rahaan haben Lakuti und Tama auch das New Yorker Duo musclecars eingeladen. Deren Label und Partyreihe Coloring Lessons haben in New York in den vergangenen Jahren ein jüngeres Publikum für House Music begeistern können, während sie in Ihren Produktionen Unterstützung von Legenden wie Ron Trent, Kenny Dope oder Louie Vega erhielten. Dies wird das erste Mal sein, dass sie in Berlin spielen.",https://www.berghain.berlin/en/events/73177/
2022-10-15 Klubnacht,Various official lineup,Berghain; Panorama Bar,"„ Beim Clubbing geht es darum, gesellig und frei zu sein “, konstatierte Róisín Murphy kürzlich in einem Interview. Und kaum jemand gelingt es dermaßen gut, die Welten von Pop- und Dancemusic auf solch mitreißende Art zu verflechten, wie es die irische Superstar und passionierte Clubgängerin seit 25 Jahren tut. Sei es mit ihren flamboyanten und theatralischen Bühnenshows oder auf ihren ganzen Alben, Singles und Remixes, die sie seit ihren frühen Tagen als Sängerin von Moloko veröffentlichte: so viele Hits, so viele außergewöhnliche Momente. So ließ sie zuletzt ihrem phänomenalen, Disco-infizierten letzten Album Róisín Machine noch eine konsequenter auf den Dancefloor produzierte Version namens Crooked Machine folgen. Ihr nächster Longplayer wird wohl ein von DJ Koze produziertes Global-Pop-Album – wir hoffen auf eine Kostprobe bei Róisins Gig in der Panorama Bar im Rahmen dieser Klubnacht . Im Berghain gibt es einen Live-Act von Berghain-Resident und Modularsynth-Expertin JakoJako. Diese hat die introspektiven zwei Jahre ohne Clubbing in Studiozeit investiert, was sich mit bereits zwei Albumveröffentlichungen in diesem Jahr ausgezahlt hat. Metamorphose , erschienen auf Frank ...",https://www.berghain.berlin/en/events/73099/
2022-10-21 BITE x LUSH,Various official lineup,Berghain; Panorama Bar,"BITE versus LUSH – während heute Nacht das Label von Phase Fatale zum ersten Mal exklusiv den großen Saal bespielt, gibt es in der Panorama Bar eine zweite Ausgabe der kollaborativen Partyreihe von Lawrence Lee und Monika Martinez. Das deutsch-italienisch-griechische Duo Unhuman + Petra Flurr haben auf ihren Veröffentlichungen auf She Lost Control einen energiegeladenen Sound entwickelt, der an Postpunk und den zackigen, schrägen Nummern früher Electronic Body Music wie DAF, Front 242 und Liaisons Dangereuses anknüpft. Ihr letztes Album hieß Cause Of Chaos und passt mit seinem retro-futuristischen Sound nicht nur vom Namen her perfekt zum musikalischen Portfolio von BITE. Neben diesem Live-Act, und einem Set der ukrainischen ∄-Resident Nastya Vogan, spielen gleich zwei DJ-Duos B2B: Ancient Methods mit OTHR und Phase Fatale mit Reka. Zwischen Dopamin-ausschüttendem Rave-Sound mit Trance-Hooks, Breakbeats und hart zupackendem Techno changiert der Sound der DJs, die Lawrence Lee in die Panorama Bar geladen hat. Neben Maruwa und Roza Terenzi spielt mit Mojaher ein Mitglied von Kopenhagens Fast-Forward-Crew, die in Berlin mit mp3 eine queere, BIPoC-fokussierte Partyreihe ...",https://www.berghain.berlin/en/events/73178/
2022-10-22 Klubnacht,Various official lineup,Berghain; Panorama Bar,"Im Berghain feiert Steffi die Veröffentlichung ihres Albums The Red Hunter , das am Montag drauf auf ihrem und Virginias Label Candy Mountain erscheinen wird. Auf ihrem vierten Album vereint sie 90er-Jahre-Intelligent-Dance-Music, Breaks und zeitgenössischen Electro zu diesem sehr speziellen Steffi-Sound, der Abstraktion und Songstrukturen zusammenbringt. In dieser Klubnacht präsentiert sie ihre neue Musik live. Das Duo Blasha & Allatt sind als DJ-Team und ihrer Partyreihe Meat Free eine feste Größe in der Technoszene Manchesters, in diesem Jahr haben sie außerdem mit FrixXxion eine queere Clubnacht lanciert. Ihr Stil: Klassisch geschulter Techno, Acid und Electro im mittleren Temposegment in einem sehr dynamischen Mix. Den B2B-Part übernehmen im Berghain heute Nacht Mojuba-Head Don Williams und Kosta Athanassiadis alias XDB. Techno mit Ambient- und Krautrockstrukturen gibt es beim Live-Act in der Panorama Bar: INIT ist das gemeinsame Projekt von Benedikt Frey und Nadia D'Alò, das im Sommer mit NRGY ein sehr gutes Album auf Optimo Music veröffentlicht hat. Ein weiteres Album-Release eines unserer Residents feiert heute Massimiliano Pagliara, dessen neuer Longplayer See You In ...",https://www.berghain.berlin/en/events/73100/
2022-10-28 Jack Your Body,Various official lineup,Panorama Bar,"Jack, jack, ya jack jack your body bei der ersten von Honey Dijon kuratierten neuen Partyreihe in der Panorama Bar. „ It's a celebration of music without borders for all spectrums of the dancefloor. From upcoming talent to heritage artists, it will be a house music extravaganza “, verspricht das Chicagoer Multitalent. Luke Solomon hat sich in den vergangenen drei Dekaden als DJ, Betreiber der einflussreichen Labels Music For Freaks und Classic sowie als Produzent vieler House-Klassiker den Status als britische House Music Royality ehrlich verdient. Honey bezeichnet ihn als ihren Bernie Taupin (britischer Lyriker und Songwriter für Elton Johns „Candle In The Wind“), zuletzt haben die Beiden an den Songs „Cozy“ und „Alien Superstar“ von Beyoncés neuem Album Renaissance zusammengearbeitet. Wer jackt auch noch? Josh Caffé, der Londoner DJ, Sänger und Veranstalter der queeren Sonntagstagesparty Love Child, sowie die Rotterdamer DJ und Mitarbeiterin der dortigen Plattenladeninstitution Clone, Suze Ijó. Preach to the children!",https://www.berghain.berlin/en/events/73179/
2022-10-29 Klubnacht,Various official lineup,Berghain; Panorama Bar; Säule,"Es ist keine Übertreibung, Alan Abrahams als einen der feinsinnigsten Autoren elektronischer Tanzmusik zu bezeichnen. Mit seinen Projekten Portable und Bodycode hat der Südafrikaner aus der langen Geschichte von House Music, verlockender Polyrhythmik, einer in Text und Tenorstimme artikulierten Spiritualität und konzeptstarken Alben auf Labels wie Perlon und !K7 ein ausdrucksstarkes Werk geschaffen. Sein aktuelles Album My Sentient Shadow ist im Februar auf Circus Company erschienen und ist eine Analogie auf einen Schatten, der sein eigenes Bewusstsein entwickelt, produziert mit Abrahams Sinn für die nuancierten Zwischenstufen tief empfundener Emotionalität. Zu dieser Klubnacht wird er seine Musik live in der Säule präsentieren. Am Ende eines Monats mit vielen B2B-Sets haben wir heute neben dem gemischten Doppel aus Daria Kolosova und unserem Resident Etapp Kyle mit den beiden Berliner Stützpunkt-Residents Chami und OPH noch einmal eine Variation des Themas im Berghain: sie spielen mit vier Plattenspielern und zwei Mixern nicht hintereinander oder nebeneinander, sondern gleichzeitig sich gegenüberstehend. Ihr Panorama-Bar-Debüt feiert heute Bashkka, Sängerin, Produzentin und ...",https://www.berghain.berlin/en/events/73101/
2022-11-04 REEF,Various official lineup,Panorama Bar; Berghain,"Sicaria Sound ist das gemeinsame DJ-Projekt der zwei Londonerinnen Sancha Ndeko und Imbratura. In ihren Sets verschmelzen sie Grime, Dubstep, Dancehall und andere Soundsystem-Musikkulturen zu einem frenetischen 140 BPM-Mix, der den Klassikern der Genres ebenso Raum lässt wie zukunftsweisende, neue Tracks. Ihre Mixes kann man außerhalb der Clubs bei ihren Resident-Shows bei Sendern wie BBC1, NTS und Rinse FM hören. Sicaria Sound legen zusammen mit der REEF-Veranstalterin Darwin und REEF-Resident (Ricardo) Esposito im Berghain auf, als very special guest star gibt es einen Live Act von Shackleton. Dieser hat kürzlich mit The Majestic Yes eine fantastische EP auf Honest Jon's veröffentlicht, auf der er in Dakar aufgenommene Sabar-Trommel-Rhythmen in Shackleton-typische Percussion-Epen überführt. In der Panorama Bar spielen unter anderem Ghost Phone, ein anonym agierendes Projekt, das bislang auf sechs gleichnamigen Label veröffentlichten Maxis, UK-Garage- und Dubstep-Versionen von nicht ganz unbekannten R&B- und HipHop-Klassikern veröffentlichte. Mit harschen, scharfkantigen Sounds reichert Manuka Honey ihre polyrhythmischen Produktionen und DJ-Sets an, nicht umsonst hat die ...",https://www.berghain.berlin/en/events/73180/
