Event,Artist,Location,PressText,SourceURL
2021-10-02 Klubnacht,Various official lineup,Berghain; Panorama Bar,"We are excited about our first Klubnacht after almost 19 months, which we can celebrate at Berghain and Panorama Bar with you and our artists. We will be reuniting with some of our residents and longtime friends of the house, as well as for the first time indoors with Gabrielle Kwarteng and Vale Budino, who wowed us with their sets at Klubgarten . Music is often described as something universally human, as a language that is understood everywhere in the world. It makes no evolutionary sense, but since the beginning of human history music was known to strengthen the sense of community. It is an echo of our humanity that leads to similar structures and is recognized regardless of cultural backgrounds – be it a love song or a dance track. Music is the answer. In this spirit: Let the bass kick and see you on the dancefloor!",https://www.berghain.berlin/en/events/73043/
2021-10-09 Klubnacht,Various official lineup,Berghain; Panorama Bar,"In our second Klubnacht , the focus at Berghain will be on Berlin-based collective Mala Junta, a queer party series started three years ago by DJ Tool and Hyperaktivist. With their community ethos, based on inclusivity and diversity, they hold the flags high for a solidarity and an intimate rave space. Musically, they are heavily influenced by hard, fast, funky techno fused with psychedelic trance, breaks and other genres. This Klubnacht both of them will be celebrating together with their resident DJs, D.Dan and Why Be, and Mama Snake, the latter an active part of the Copenhagen Techno scene and co-operator of the interdisciplinary creative platform Amniote Editions. Known for her super energetic rave sets, mixing techno with breakbeats, jungle and footwork in the best UK dance style, Ghanaian-born and London-based DJ Yazzus plays her Berghain debut today alongside well-known DJs like DVS1 and Norman Nodge.",https://www.berghain.berlin/en/events/73047/
2021-10-16 Klubnacht,Various official lineup,Berghain; Panorama Bar,"SPFDJ and VTSS are two allied DJs who have become the most successful purveyors of loud, fast, EBM- and industrial-influenced techno in recent years. “ Techno, Acid, Hardcore, Trance, Anal Sex” is bluntly written on the label shirt of Intrepid Skin, the label of SPFDJ, on which VTSS contributed the first catalog number three years ago. It's this particular humor that also shines through again and again in their sets, which are rowdy in the best sense of the word. They've already played a B2B set at Säule, and tonight they're DJing alongside FJAAK, Freddy K and Lokier for Klubnacht at Berghain. At Panorama Bar we meet Âme again as well as duo Nemo & Castro, the two are the operators of the Kreuzberg record store Sound Metaphors. On their formidable reissue label Miss You they gallantly perform the balancing act between soulful German Christian Disco (Heike Tittmann - Wie ein Baum will ich sein ) and mid-80s Hi-NRG gay porn soundtrack (Richard Jan Plasko - California Big Hunks ): answered prayers.",https://www.berghain.berlin/en/events/73048/
2021-10-23 Klubnacht,Various official lineup,Berghain; Panorama Bar,"Sugar is a DJ, producer and co-founder of Fast Forward Productions, a Copenhagen party collective founded in 2015 that has made significant contributions to the newer fast techno sound that the Danish underground stands for today. Sugar's music – as a DJ or producer on labels like Euromantic, Kulør or his own, Perfumery – on the one hand fulfills all expectations one might have of him: it is mercilessly fast, melodic and has an extreme punch. But you can also hear sophisticated textures and psychedelic effects again and again, which sound more like a modernized version of mid-90s UK electronica. Also on the fast side is Berlin-based Frenchwoman Wallis, who not only works as a sound engineer but also runs her own label, Jell, whose musical guideline she sets with “ Violence is never the solution except when it comes to techno music. ” In addition to Honey Dijon and Ryan Elliott, two Irish DJs will be playing at Panorama Bar today: Cromby and Sally C. The former was resident DJ at Belfast's Shine Club for a long time before moving to Berlin and also making a name for himself as a producer with funky jacking House records like his latest REKIDS ( Twisted Future ). Sally C, on the ...",https://www.berghain.berlin/en/events/73049/
2021-10-30 Klubnacht,Various official lineup,Berghain; Panorama Bar,"With his label WSNWG, Rødhåd follows a simple goal: he releases the music he has recorded together with artist friends in his Berlin studio. The latest catalog number 8, released in September, is a collaboration with Fadi Mohem, who has already proven his techno skills on records for Klockworks and Seilscheibenpfeiler. Rødhåd and Fadi Mohem are DJing today with Barker, Luke Slater and the artist Nene H, who is commuting between Copenhagen and Berlin, among others. At Panorama Bar, you can hear a set from FKA.m4a for the first time. The British DJ started his career five years ago in London, now lives in Berlin and is known for his 90s house and italo disco sets sparkling with joy. “pano_ramic” is then also the name of one of his high spirited piano house tracks. The immediate joyfulness, the sugary energy rush that simple piano chords can trigger, simply remains one of the most proven house formulas. In addition to FKA.m4a, we're also delighted to see Cinthie, Gerd Janson, Mor Elian, Palms Trax and Roman Flügel today.",https://www.berghain.berlin/en/events/73050/
2021-11-05 Italorama Bar,Various official lineup,Panorama Bar,"Our first Panorama Bar night in November is a tribute to Italo Disco, that eternally young and dazzling pearl in the long history of electronic dance music. Never before and rarely since has hedonism sounded so innocent and cool at the same time as in the spaceship-like mega-discotheques on the Adriatic coast in the early to mid 80s. With its melodies often pushing the boundaries of kitsch, futuristic vocoder vocals, club-ready drum machine grooves and seductively chirping arpeggios, it was on the one hand a fully computerised, inexpensively produced echo of disco and in turn influenced the early pioneers of Chicago house music. To this day, there are numerous DJs and producers who also know how to put their own stamp on the Italo canon. With Franz Scala and Giulia Gutterer, two protagonists of the Berlin label Slow Motion can be heard in Italorama Bar , as well as Vale Budino and I-F, whose legendary Mixed Up In The Hague compilation triggered a major Italo revival more than 20 years ago.",https://www.berghain.berlin/en/events/73294/
2021-11-06 Klubnacht,Various official lineup,Berghain; Panorama Bar,"Utopian Surrealism is the name of Dax J's new album, and it addresses the big issues of our time: the erosion of universally valid truths in times of disinformation campaigns, the increasing radicalisation within networks, artificial intelligence – all of it, as is his style, poured into a high-energy techno groove and arranged with a lot of drama and verve, just as such a dystopian theme demands. Dax J plays Berghain tonight with Ben Klock, Naty Seres, Nur Jaber, Steffi and Stephanie Sykes. In Panorama Bar, Jennifer Cardini, Mystery Affair, nd_Baumecker and Virginia will be playing alongside the two DJ friends Massimiliano Pagliara and Luigi Di Venere. Both of them have just released the excellent Italo proto-house EP Delphinium Blue on Pagliara's label Funnuvojere, which they released under the name Banana Moon. The title is a reference to filmmaker Derek Jarman's favourite flower, whose vibrant Yves Klein blue he featured throughout the duration of his last film, Blue . Italians (still) do it better.",https://www.berghain.berlin/en/events/71241/
2021-11-12 Your Love,Various official lineup,Panorama Bar,"Your Love is a party series that Tama Sumo and Lakuti have been hosting irregularly at London club Dance Tunnel. It is, as the name suggests, an affair of the heart. And also a reference to the early Chicago House song by the same name by Jamie Principle and Frankie Knuckles, a love song sung with piercing passion by Principle that has lost none of its anthemic character even 35 years after its first release. For the first Your Love night at Panorama Bar, Tama Sumo and Lakuti invited London-based DJ Shy One. Shy One started DJing in London's pirate radio stations at the age of 13, drawing inspiration from the rich and diverse club music styles of her hometown such as UK garage, deep house, grime and dubstep. Ten years ago she released her debut EP on DVA Music, most recently contributing “House Party” to the 5 Years of Rhythm Section INTL compilation.",https://www.berghain.berlin/en/events/73129/
2021-11-13 Klubnacht,Various official lineup,Berghain; Panorama Bar,"Italian DJ Adiel holds a residency at Rome's Goa Club and has also made a name for herself in recent years as a producer of minimalist, hypnotic techno. Adiel produces highly psychoactive music for the trippy, self-absorbed moments on the dancefloor, whether with her precision-produced solo releases or with her collaborations with Donato Dozzy and Anthony Linell. Her own label is tellingly called Danza Tribale, but she has also released on Figure, Stroboscopic Artefacts and Kangding Ray's ARA. Adiel plays at tonight's Klubnacht with Blawan, Fiedel, JakoJako, Marcel Dettmann and Nihad Tule. Nothing less than releasing new Detroit classics while gently pushing the Motor City's often traditional sound into the future is the declared goal of Monty Luke and his label Black Catalogue. The DJ and producer, who now lives in Berlin, managed Carl Craig's Planet E for a few years before founding his own platform. His music, such as the recently released Vibe The Feel EP, indeed shows itself deeply rooted in Detroit's long history and at the same time sounds as vital and relevant as one can expect from future classics. In addition to Monty Luke, Cormac, Hannah Holland, Kim Ann Foxman and ...",https://www.berghain.berlin/en/events/73051/
2021-11-20 Klubnacht,Various official lineup,Berghain; Panorama Bar,"Tonight's Klubnacht at Berghain features DJ Stingray 313 and Salome, two DJs who consistently incorporate the special syncopated funk of electro into their sets and productions. For Salome, who was born in Tbilisi and now lives in Berlin, the genre with its broken rhythm and retrofuturistic sounds was her first really strong club music experience. The Herrensauna resident DJ released Fatal Glow , her debut EP on Lobster Theremin this summer, combining gritty electro grooves with a very contemporary rave appeal. At Panorama Bar, you can look forward to sets by OK Williams and Orpheu The Wizard, to name just a few. Orpheu de Jong is a music-cultural institution in Amsterdam: he co-founded the excellent radio station Red Light Radio and opened an audiophile bar in an old bullet factory a few years ago, he regularly designs record covers for labels like Dekmantel and Off Minor and, not insignificantly in this context, he is also a fantastic DJ.",https://www.berghain.berlin/en/events/73052/
2021-11-27 Klubnacht,Various official lineup,Berghain; Panorama Bar,"Underground & Black is the blog of Ash Lauryn, a Detroit-born, Atlanta-based DJ, producer and writer. To remain aware of the black roots of house and techno, to convey this knowledge creatively and to promote new musical sprouts where they can be identified is her mission. She has just released her debut solo release, the Truth EP , which makes a strong statement with its soulful deep house tracks guided by her vocals: Life Is Back , indeed. Also a fixture in Detroit's current music scene is DJ Holographic, whose sets pay tribute to her hometown's rich history, seamlessly blending dance genres from different eras such as funk, soul, disco, house and techno. You can hear what this sounds like on the Detroit Love mix compilation released this spring on Planet E, for which she has compiled exclusively new material by Detroit artists. Ash Lauryn and DJ Holographic will be spinning tonight at Klubnacht with such illustrious colleagues as Eris Drew, Octo Octa, Bambounou and Schacke. Attention: Unfortunately Octa Octa's set has to be omitted due to personal reasons.",https://www.berghain.berlin/en/events/73053/
2021-12-03 Finest Friday,Various official lineup,Panorama Bar,"Ravemom, Nap Queen, Schutzpatronin des Sonntagmorgen – Marea Stamper alias The Blessed Madonna hat im Laufe ihrer beachtenswerten Karriere schon viele Zuschreibungen erhalten. Sie war bereits viele Jahre Resident und Bookerin im Chicagoer Club Smartbar, bevor sie als fabelhafte DJ und charismatische Sprecherin eines neuen, queeren Selbstbewusstseins auf internationalem Parkett reüssierte. Wie tief verwurzelt sie in der Geschichte von Dance Music ist, kann man sehr gut anhand ihrer wöchentlichen Radioshow We Still Believe nachvollziehen, die sie ab August 2020 für sieben Monate für Rinse FM produzierte. The Blessed Madonna schöpft musikalisch gerne aus dem Vollen, sei es Disco, House oder Pop. Diese bedingungslose Neugierde auf Musik teilt sie mit unserem Resident-DJ nd_baumecker, mit dem sie diesen Finest Friday in der Panorama Bar gestalten wird. Gesegnet seien die Tanzwütigen. Achtung: Leider muss das Set von The Blessed Madonna kurzfristig aus persönlichen Gründen entfallen.",https://www.berghain.berlin/en/events/70501/
2021-12-04 Klubnacht,Various official lineup,Berghain; Panorama Bar,"Mit 33 Episoden ihrer Streamingshow Quarantine FM konnte uns Dr. Rubinstein mit illustren Gästen der Berliner DJ-Welt auf äußerst unterhaltsame Weise durch die clublose Zeit navigieren. Sie selbst bezeichnet sich ja als front row dancer , und nicht nur deshalb freuen wir uns, dass wir sie neben anderen Gästen wie Nina Kraviz, François X und Marie Montexier (die gerade ihr eigenes Label Paryía gelauncht hat) heute mal wieder vor und hinter dem DJ-Pult im Berghain sehen zu können. In der Panorama Bar begrüßen wir Josey Rebelle zurück: Die in London beheimatete DJ und Radio-Host ist alleine schon aufgrund ihrer wöchentlichen Rinse-Show schwerlich auf ein-zwei-drei-viele Genres festzulegen. Stattdessen weiß sie eben diese Genregrenzen durch stilbewusste Auswahl bei ihren Sets kontinuierlich zu überwinden – nachzuhören auf einer Vielzahl an Online-Mixes, ihrer Beats In Space -Mix-CD, ihrer Panorama Bar Playlist 04 oder dem unlängst online veröffentlichten Mixtape auf The Trilogy Tapes. Josey Rebelle spielt zur Klubnacht mit unseren Residents Massimiliano Pagliara, Paramida und Nick Höppner, wie auch der in Kyoto geborene und inzwischen in Berlin lebende Alex Kassian. Der hat bereits ...",https://www.berghain.berlin/en/events/73054/
2021-12-10 Finest Friday | Cancelled!,Various official lineup,Panorama Bar,"On occasion of the current pandemic situation and in the best health interest of everyone, events in Berghain / Panorama Bar are being discontinued until further notice.",https://www.berghain.berlin/en/events/73133/
2021-12-11 Klubnacht | 17 Jahre Berghain | Cancelled!,Various official lineup,Berghain; Panorama Bar; Säule,"On occasion of the current pandemic situation and in the best health interest of everyone, events in Berghain / Panorama Bar are being discontinued until further notice.",https://www.berghain.berlin/en/events/73055/
2021-12-18 Klubnacht | Cancelled!,Various official lineup,Berghain; Panorama Bar,"On occasion of the current pandemic situation and in the best health interest of everyone, events in Berghain / Panorama Bar are being discontinued until further notice.",https://www.berghain.berlin/en/events/73056/
2021-12-25 Finest XMAS XXL | Cancelled!,Various official lineup,Panorama Bar,"On occasion of the current pandemic situation and in the best health interest of everyone, events in Berghain / Panorama Bar are being discontinued until further notice.",https://www.berghain.berlin/en/events/73057/
2022-03-05 Klubnacht,Various official lineup,Berghain; Panorama Bar,"Klubnacht reconstruction, second try. Amsterdam-based DJ and basketball Olympian MARRØN calls Eerste Communie , the party series he's hosting, a “ holy day ”. His aim is to offer a safe, prejudice-free space with techno in its purest form – admirable! He himself plays a very dynamic, sleek and lively sound, which he will be presenting for the first time for us today. In addition to Dr. Rubinstein, Ellen Allien, Fiedel, Luigi Di Venere and the new Berghain residents Naty Seres and JakoJako, there will also be a live act by Tobias. Upstairs, we spread the musical spectrum in all colours of the rainbow: from the New Age-inspired Balearic house of Fantastic Man via the very British early 90s hardcore rave of Cromby to the stoned disco-dub of the two Idjut Boys.",https://www.berghain.berlin/en/events/73067/
2022-03-11 Your Love,Various official lineup,Panorama Bar,"Your Love is a party series that Lakuti and Tama Sumo have been hosting in various London clubs since 2015, and since November last year it has also been the name of their nights at Panorama Bar. As you'd expect from the two, they musically go all out on Your Love nights, digging deeper on the guest DJ invites and celebrating the more soulful moments of the dancefloor with them. For their second party in Panorama Bar, they've invited Wendel Sield, an Amsterdam DJ who fits perfectly the musical concept with his jazz, funk and soul-inspired deephouse sound.",https://www.berghain.berlin/en/events/73146/
2022-03-12 Klubnacht,Various official lineup,Berghain; Panorama Bar,"Colin Benders, tonight's live act in Berghain, is a master of modular synthesis. In recent years he has been able to expand the possibilities of playing live like hardly anyone else. Since he approaches each of his performances from scratch, every sound on the dance floor remains as ephemeral as it is unique. The Dutchman has emancipated himself from the usual record-release-play live cycle, but in the past two years several records, some of them strictly limited, have been released in cooperation with Speedy J. For the first time in Panorama Bar we welcome Jenny Cara, who worked in booking and organisation with Zurich's Club Zukunft for many years. Also debuting is Roman FX, a Frenchman living abroad in Hong Kong, whose sets come with a refreshing mix of new beat, disco, house and italo. Bottom Heavy is the DJ team by Wes Baggaley and Dan Beaumont. Together they host the LGBTQI+ party series of the same name at Dalston Superstore and beyond – house, disco, hi-nrg and more for all bottoms, tops and versatiles. PLEASE NOTE: Unfortunately Efdemin's set has been omitted. Norman Nodge will be playing in his place.",https://www.berghain.berlin/en/events/73068/
2022-03-18 PAN,Various official lineup,Panorama Bar,"For the first PAN night of this season, Bill Kouligas has invited several exciting guests who are working independently on the evolution of rhythmic phrasing. Swedish producer Toxe is part of the STAYCORE crew in her hometown of Stockholm, her DJ sets are light and sonically wide-ranging: Toxe's FF radio shows on NTS give space to ambient meditations, r'n'b, acid funk, pop, mathrock and more eclectic stuff beyond – hi-tech futurism with a human face. Producer and visual artist Nkisi lives and works between Berlin and London. Like her visual performances, her club sets are full of electrifying energy: floating sounds clashing with powered electronics. Low Jack is a Paris-based musician, DJ and label owner who grew up in Honduras. In the early years of his career, he released techno and house on labels such as Delsin, and later a kind of stumbling industrial ambient sound on L.I.E.S. and Modern Love, until he finally arrived with his current, more aggressive dancehall trap grime sound with his DJ sets, constantly building up rhythmic structures and destroying them again. Today he'll be playing B2B with PAN label head Bill Kouligas. Rounding off this line-up is Oli XL. He is a ...",https://www.berghain.berlin/en/events/73147/
2022-03-19 Klubnacht,Various official lineup,Berghain; Panorama Bar,"In recent years, Berlin-based Swede Philippa Pacho has focused on a fresh, groovy techno sound that elegantly combines a 90s oldschool vibe with the finesse of contemporary productions. At the beginning of her career, she founded the collective Sthlm Murder Girls with a few friends, and since 2010 she's been a resident at Stockholm club Under Bron. Together with her artist friend Blue Hour she has been running the label positivesource since 2021, which saw release of two excellent compilation EPs with tracks by Sugar, Alan Backdrop and Lady Starlight, among others. For this Klubnacht , Pacho will play her Berghain debut alongside artists such as Elli Acula, Luke Slater and – in an unusual setting – Massimiliano Pagliara. Faith Beat is a fit label name; after all, faith in a better tomorrow is an elementary pillar on which the US house scene in particular had been built. Alongside Faith Beat head Ryan Elliott, Panorama Bar all-star ensemble Alinka, Dinky, Gerd Janson, Midland and Roi Perez invites you to today's holy house mass.",https://www.berghain.berlin/en/events/73069/
2022-03-25 Love On The Rocks,Various official lineup,Panorama Bar,"Paramida's Love On The Rocks is a boutique label, being run with heart and soul, revealing music full of character, ranging from spacey disco, house, acid to ambient with every single catalogue number since 2014 – all that (and more) on the occasional 12"". Joining our resident for her label night at Panorama Bar are label artists Alex Kassian and Youandewan, as well as Italian DJ Francesco del Garda. Kassian, who debuted as a solo artist on Love On The Rocks in 2020 with the Oolong Trance EP, has just curated the Panorama Bar Playlist 08 , available on all streaming platforms. His selection, please allow for the shameless self-promotion, is lots of fun: from early 90s progressive ambient act Spooky and the glistening children's chant electronica of Oneohtrix Point Never, he's placed serotonin-charged house trax, cosmic disco epics and classics by Danny Tenaglia, Joey Beltram and Jesus Loves You – clearly a case of love on the decks .",https://www.berghain.berlin/en/events/73148/
2022-03-26 Klubnacht,Various official lineup,Berghain; Panorama Bar,"House music has always been able to convey universal wisdom about human nature, its desires and longings – especially from that part of the African American community whose roots reach deep into the gospel and soul culture of the 70s and 80s. No one knows better than Honey Dijon who in recent years almost single-handedly reinstalled expressive diva vocals on the main floors. The other DJs playing Panorama Bar today also know about the transcendental power of vocals: Lisbon-based Brit Joe Delon, for example, plays a lot of it. His genre-bending, uplifting mixes are peppered with disco, house and electro tracks from all eras. Downstairs sees Klubnacht premieres of Alex Levin and Key Clef. Berlin-based Israeli Levin is the resident DJ of the queer party series PAG in Tel Aviv and already played his trippy techno at FC SNAX United two years ago. Ipnotica Erotica is the great-sounding label name of Italian Key Clef, also based in Berlin. As a DJ and producer she shows a strong preference for melodic, nuanced and analogue-sounding techno and electro.",https://www.berghain.berlin/en/events/73070/
2022-04-01 Italorama Bar,Various official lineup,Panorama Bar,"Do androids dream of electric cats? At least that's what you might think when you hear the flowing, retro-futuristic sets of Canada-raised, Berlin-based Lazercat, a DJ, producer and organiser of the Dreams Of Neon party series. Italo Disco, New Wave and New Beat, EBM, Electro and Techno – these are also the rough coordinates of our first Italorama Bar party this year. In addition to Lazercat, the hosts Franz Scala and Giulia Gutterer from Berlin's Slow Motion label will be playing. On top comes French-Italian DJ and producer Pablo Bozzi who not only sports his moustache proudly like Giorgio Moroder did, but also pushes an updated, more muscular electronic disco sound – no matter if solo with his latest 12"" on Dischi Autunno, together with Hayden Payne aka Phase Fatale as Soft Crash, or with Kendal Mulla as Infravision. The latter have just released an extremely successful, muscular remix of Anne Clark's proto-techno wave hit “Our Darkness”, beaming her doomsday 80s poetry into a no less dark present day. Doubting all the time / Fearing all the time / That like these urban nightmares / We'd blacken each other skies.",https://www.berghain.berlin/en/events/73149/
